{"completion_status":"not_started","form_id":"semantic-prescreen-portable-blank-form-v1","human_semantic_prescreen_only":true,"plan_id":"semantic-prescreen-portable-blank-plan-v1","plan_sha256":"sha256:e56061fca024a8a68443f628f04660969eca9f97709f202eb593c8d08a6b4722","prohibited_assignments":{"blind_finder_eligible_for_reviewed_sources":false,"h1_assigned":false,"h2_assigned":false,"necessity_assigned":false,"saturation_auditor_eligible_for_reviewed_sources":false},"record_type":"semantic_av_source_prescreen_annotation","reviewer":{"completed_at":null,"protocol_version":"semantic-av-source-prescreen-v1","reviewer_id":null,"started_at":null,"training_attested":false},"schema_version":"1.0.0","source_reviews":[{"authoring_constraints":[],"authoring_eligibility":"undecided","candidate_facts":[],"decision_rationale":"","privacy_review":{"assessment_status":"not_assessed","concerns":[],"notes":""},"repair_actions":[],"safety_review":{"assessment_status":"not_assessed","concerns":[],"notes":""},"sample_reviews":[{"concrete_non_speech_audio_events":[],"dynamic_non_text_visual_events":[],"notes":"","review_status":"not_reviewed","sample_id":"semantic-prescreen-portable-blank-plan-v1.sample-0001","speech_presence":"unknown","substitution_risk":{"caption":{"level":"unknown","notes":""},"narration":{"level":"unknown","notes":""},"ocr":{"level":"unknown","notes":""},"transcript":{"level":"unknown","notes":""}}},{"concrete_non_speech_audio_events":[],"dynamic_non_text_visual_events":[],"notes":"","review_status":"not_reviewed","sample_id":"semantic-prescreen-portable-blank-plan-v1.sample-0002","speech_presence":"unknown","substitution_risk":{"caption":{"level":"unknown","notes":""},"narration":{"level":"unknown","notes":""},"ocr":{"level":"unknown","notes":""},"transcript":{"level":"unknown","notes":""}}},{"concrete_non_speech_audio_events":[],"dynamic_non_text_visual_events":[],"notes":"","review_status":"not_reviewed","sample_id":"semantic-prescreen-portable-blank-plan-v1.sample-0003","speech_presence":"unknown","substitution_risk":{"caption":{"level":"unknown","notes":""},"narration":{"level":"unknown","notes":""},"ocr":{"level":"unknown","notes":""},"transcript":{"level":"unknown","notes":""}}}],"source_group_id":"portable-source-group-a","source_id":"portable-source-a","temporal_recurrence":{"assessment_status":"not_assessed","groups":[],"notes":""}},{"authoring_constraints":[],"authoring_eligibility":"undecided","candidate_facts":[],"decision_rationale":"","privacy_review":{"assessment_status":"not_assessed","concerns":[],"notes":""},"repair_actions":[],"safety_review":{"assessment_status":"not_assessed","concerns":[],"notes":""},"sample_reviews":[{"concrete_non_speech_audio_events":[],"dynamic_non_text_visual_events":[],"notes":"","review_status":"not_reviewed","sample_id":"semantic-prescreen-portable-blank-plan-v1.sample-0004","speech_presence":"unknown","substitution_risk":{"caption":{"level":"unknown","notes":""},"narration":{"level":"unknown","notes":""},"ocr":{"level":"unknown","notes":""},"transcript":{"level":"unknown","notes":""}}},{"concrete_non_speech_audio_events":[],"dynamic_non_text_visual_events":[],"notes":"","review_status":"not_reviewed","sample_id":"semantic-prescreen-portable-blank-plan-v1.sample-0005","speech_presence":"unknown","substitution_risk":{"caption":{"level":"unknown","notes":""},"narration":{"level":"unknown","notes":""},"ocr":{"level":"unknown","notes":""},"transcript":{"level":"unknown","notes":""}}},{"concrete_non_speech_audio_events":[],"dynamic_non_text_visual_events":[],"notes":"","review_status":"not_reviewed","sample_id":"semantic-prescreen-portable-blank-plan-v1.sample-0006","speech_presence":"unknown","substitution_risk":{"caption":{"level":"unknown","notes":""},"narration":{"level":"unknown","notes":""},"ocr":{"level":"unknown","notes":""},"transcript":{"level":"unknown","notes":""}}}],"source_group_id":"portable-source-group-b","source_id":"portable-source-b","temporal_recurrence":{"assessment_status":"not_assessed","groups":[],"notes":""}}]}
