{"completion_status":"not_started","form_id":"epic-dev-task171-P27_101-prescreener-form","human_semantic_prescreen_only":true,"plan_id":"epic-dev-task171-P27_101-task153-plan","plan_sha256":"sha256:044896463ede2a66e2ea1c9adc3c54e7066d71bded700562bade6dcb28391ba4","prohibited_assignments":{"blind_finder_eligible_for_reviewed_sources":false,"h1_assigned":false,"h2_assigned":false,"necessity_assigned":false,"saturation_auditor_eligible_for_reviewed_sources":false},"record_type":"semantic_av_source_prescreen_annotation","reviewer":{"completed_at":null,"protocol_version":"semantic-av-source-prescreen-v1","reviewer_id":null,"started_at":null,"training_attested":false},"schema_version":"1.0.0","source_reviews":[{"authoring_constraints":[],"authoring_eligibility":"undecided","candidate_facts":[],"decision_rationale":"","privacy_review":{"assessment_status":"not_assessed","concerns":[],"notes":""},"repair_actions":[],"safety_review":{"assessment_status":"not_assessed","concerns":[],"notes":""},"sample_reviews":[{"concrete_non_speech_audio_events":[],"dynamic_non_text_visual_events":[],"notes":"","review_status":"not_reviewed","sample_id":"epic-dev-task171-P27_101-task153-plan.sample-0001","speech_presence":"unknown","substitution_risk":{"caption":{"level":"unknown","notes":""},"narration":{"level":"unknown","notes":""},"ocr":{"level":"unknown","notes":""},"transcript":{"level":"unknown","notes":""}}},{"concrete_non_speech_audio_events":[],"dynamic_non_text_visual_events":[],"notes":"","review_status":"not_reviewed","sample_id":"epic-dev-task171-P27_101-task153-plan.sample-0002","speech_presence":"unknown","substitution_risk":{"caption":{"level":"unknown","notes":""},"narration":{"level":"unknown","notes":""},"ocr":{"level":"unknown","notes":""},"transcript":{"level":"unknown","notes":""}}},{"concrete_non_speech_audio_events":[],"dynamic_non_text_visual_events":[],"notes":"","review_status":"not_reviewed","sample_id":"epic-dev-task171-P27_101-task153-plan.sample-0003","speech_presence":"unknown","substitution_risk":{"caption":{"level":"unknown","notes":""},"narration":{"level":"unknown","notes":""},"ocr":{"level":"unknown","notes":""},"transcript":{"level":"unknown","notes":""}}},{"concrete_non_speech_audio_events":[],"dynamic_non_text_visual_events":[],"notes":"","review_status":"not_reviewed","sample_id":"epic-dev-task171-P27_101-task153-plan.sample-0004","speech_presence":"unknown","substitution_risk":{"caption":{"level":"unknown","notes":""},"narration":{"level":"unknown","notes":""},"ocr":{"level":"unknown","notes":""},"transcript":{"level":"unknown","notes":""}}},{"concrete_non_speech_audio_events":[],"dynamic_non_text_visual_events":[],"notes":"","review_status":"not_reviewed","sample_id":"epic-dev-task171-P27_101-task153-plan.sample-0005","speech_presence":"unknown","substitution_risk":{"caption":{"level":"unknown","notes":""},"narration":{"level":"unknown","notes":""},"ocr":{"level":"unknown","notes":""},"transcript":{"level":"unknown","notes":""}}},{"concrete_non_speech_audio_events":[],"dynamic_non_text_visual_events":[],"notes":"","review_status":"not_reviewed","sample_id":"epic-dev-task171-P27_101-task153-plan.sample-0006","speech_presence":"unknown","substitution_risk":{"caption":{"level":"unknown","notes":""},"narration":{"level":"unknown","notes":""},"ocr":{"level":"unknown","notes":""},"transcript":{"level":"unknown","notes":""}}}],"source_group_id":"P27","source_id":"P27_101","temporal_recurrence":{"assessment_status":"not_assessed","groups":[],"notes":""}}]}
